{
  "contract_version": {
    "major": 1,
    "minor": 0
  },
  "run_kind": "analyze",
  "analysis_kind": "clonality",
  "correlation_id": "11111111-1111-4111-8111-111111111111",
  "inputs": {
    "paths": [
      "/path/to/run/26OUM04817_IGK_270326_B05_H9H1DI2F.fsa"
    ],
    "manifest_path": null,
    "report_source_path": null
  },
  "output": {
    "root_dir": "/tmp/fraggler-v2/analyze",
    "report_dir": "/tmp/fraggler-v2/analyze/REPORTS",
    "artifacts_dir": "/tmp/fraggler-v2/analyze/artifacts"
  },
  "options": {
    "max_workers": 8,
    "deterministic": true,
    "emit_compact_json": true,
    "open_reports_in_browser": true,
    "shadow_reference_python": false,
    "extra": {}
  }
}
